review_id,source,author,rating,body,app_version,date_posted,topics,sentiment,insight
126604e73e72d42e6726cc68f95aa8a1abac584575337bee0a00c2bc881dbda4,Trustpilot,Owen,1,"Ive had The same issue since December its now 30th March, all I needed to do was change direct debit dates, this would normally be straightforward of a job for any company except Scottish power.
Ive been on the phone a total of 8 different times and each phone call lasting over an hour to do this. I wanted to change from the 6th of each month to the 21st of each month due to changing jobs and the pay dates were different.
I thought this was sorted after the first 2 conversations but they went on to take payments on the 14th and then the 16th then after more conversations and more people telling me they have 100% sorted it they just didnt take payment at all. The amount of stress this has caused me has 100% made me realise I will never refer anyone to Scottish power, you could pardon a mistake once of twice due to the language barrier that was in hand but this much hassle for a simple objective is bone idle and lack of care from customer services. 
Then the last lady I spoke to she was worth her weight in gold, finally someone at Scottish power who cared, she didn't only manage to do the ""impossible"" of changing a direct debit date but she also managed to find a fault with my gas meter she jumped through all the hoops and processes to sort it out for me and got it sorted and scheduled a follow-up call to see if 1, the payment come out on the chosen date and 2, if the gas meter is up and running still. If Scottish power had more of that lady working with them they would have a long list of happy customers and achieve great things, instead ive had to go through multiple people who didn't care about me as a customer and had absolutely no enthusiasm towards what job they were clocked in to do and get paid for.",,2026-03-30T18:59:37,"[""billing"", ""customer_service""]",negative,"A 4-month struggle to change direct debit dates due to repeated errors and poor customer service, though one exceptional staff member ultimately resolved the issue and identified a gas meter fault."
65353dacecc3907906abca210182b2798ca14a47029608059bfaeb5527008cff,PlayStore,Beth McCrossan,1,"can't even log in, why does everything have to be an app that doesn't work",,2026-03-30T18:58:39,"[""login"", ""app_crash""]",negative,User is frustrated by inability to log in and perceives the app as fundamentally unreliable.
38cebb5f4cbec6192a2e06418d33b67436291fe3923df7057234314e83ca6603,Trustpilot,Stephen Clarke,4,Keeping my gass and electric bills in one place .easier for me ,,2026-03-30T18:33:35,"[""billing"", ""account""]",positive,User appreciates the convenience of managing both gas and electricity bills through a single app interface.
c36aec1c9ac9a66042aeeee44b3318fab831e6ffca2ed1248a5f14fb323537c5,Trustpilot,Gman Can,1,"If I could give less than 1 star then I would.

They are breathtakingly incompetent.

In the past 3 years I have spent a total of more than 6 hours on the phone trying to resolve an issue which is entirely caused by Scottish Power. The call centre staff are generally very pleasant and usually helpful. I get assured repeatedly that they understand the issue and they say that it is all written in the file for the next person to see but mostly that does not happen. I get further calls but the caller cannot see that I have been told the issue is resolved (It has not been). The cycle of confusion continues....just rinse and repeat, as it were. The final straw came today when I was contacted by solicitors chasing a debt but they had been instructed the same day that Scottish Power last assured me that there was no problem.

The Scottish Power account is in the name of my elderly sister who has dementia and Alzheimers but lives alone. She is on the S.P. VUlnerable Person list (but keeps getting removed from that). I have authorisation to deal with S.P. and hold a power of attorney. The customer has a direct debit arrangement in place and I have been repeatedly told by S.P. on the phone that they are happy and the account details are correct BUT when they issue bills, the bills say on them that the agreed amount will be taken on a particular date. The invoices say clearly ""you do not need to do anything further"". S.P. then fails to take the direct debit (despite assurances that they will) and so the debt builds up. I have repeatedly been told that the problem is solved. On 23rd March £588 was paid on a debit card at the request of S.P. who also agreed a new monthly direct debit amount to clear the outstanding debt....at an amount higher than what they were suggesting. The customer does not dispute the bills and is quite willing to pay by the direct debit that S.P. holds.....however, S.P. just fails to take the money owing and it is not the fault of the customer or her bank. So I believed that the matter was resolved by S.P. on 23rd of March when I spoke several times to a woman called Ndombe at their call centre in South Africa who totally assured me thaT Scottish Power was now happy and it had been all their fault. Later that  same day S.P. instructed Flint Bishop Solicitors to persue the customer despite telling me that the issue was resolved and had been the fault of Scottish Power. If this matter continues, I will not rest until it has been aired in the press and on TV consumer shows.",,2026-03-30T18:30:48,"[""billing"", ""customer_service"", ""account""]",negative,"Customer experienced years of unresolved billing and direct debit failures compounded by poor internal communication across call centre staff, resulting in debt collection action despite repeated assurances of resolution."
c64e5962a64761070a00c5060945a3ecb112330d8db558f75af8bdbbafcc4b49,PlayStore,Valerie Sturgess,5,very good,8.35.1,2026-03-30T17:01:38,"[""other""]",positive,User is satisfied with the overall quality of the app or service.
7c4f48c2bc6f46c5ce283cf00cd3fe8c27e541b924806ea39a5cdf116020751b,Trustpilot,Joan Baxter,4,"The lady I spoke to was very helpful. She helped me pay for my gas and electric on line, as sometimes I am not quick enough to type in the details or the machine does not understand what I am saying. The line went dead at one point, she very kindly called back, so we could finish the transaction. At no time did I say I was leaving.",,2026-03-30T16:49:18,"[""billing"", ""customer_service""]",positive,Customer praised helpful support staff who assisted with online payment and reconnected after a dropped call.
6037fdd2c675272ebee10af83501aff14c58853b17a66d2aebc618727ee08b16,PlayStore,Shelley Bernard,1,"This app isn't working, hasn't worked for a week. I go to log in it says there is a problem try again later, still not working, went and changed password, nope still not working.. can someone help 😫",8.35.1,2026-03-30T16:33:14,"[""login""]",negative,User has been unable to log in for a week despite attempting troubleshooting steps including password reset.
5c55f2093e0975c01281bc39e1b6ad7104070be2ea62f717b99ff27df64e4cdd,Trustpilot,Alan,1,"No point ? You have already looked into this and refused my refund ! you say it's resolved but I got no refund so not resolved.What a pair of bad company's .And yes I was scammed buy Scottish power and wall box.
",,2026-03-30T15:51:20,"[""billing"", ""customer_service"", ""account""]",negative,"Customer feels scammed and unresolved by ScottishPower and WallBox, with a promised refund never received despite previous complaints."
95be8568b50f5bc2f409eb9430035f726c45d64979c76a8facff9f85678a1b73,Trustpilot,Connor Dean,1,"The most rude and condescending staff I’ve ever dealt with, they accused me of lying about being on hold for an hour stating “we have call logs” so do I, they made dealing with them extremely difficult. ",,2026-03-30T15:34:19,"[""customer_service""]",negative,User experienced disrespectful and dismissive treatment from staff who contradicted their account of being on hold for an extended period.
5396bc033077247bf7385bdc7c256be83e3bd604b01aca736cd1fcbf9b93f20c,PlayStore,A Google user,1,Alls good while things work OK but if anything goes wrong it's a nightmare to get anything sorted out. Our gas meter failed last November and it's April this week and still waiting to sort the account out. Hopeless. Moving to British gas when it's sorted,8.34.0,2026-03-30T15:32:30,"[""smart_meter"", ""customer_service"", ""account""]",negative,"Customer experienced a five-month delay in resolving a failed gas meter issue, resulting in poor service satisfaction and intent to switch providers."
d64ed98fe1c0e5b9a9450620a4d17bbb444cbd52ffaee217e391f3840cc23a1a,Trustpilot,susan,1,Direct debit was cancelled due to them telling me my bill was goin up 30 quid then they rang telling me my bill would be an extra 100 pounds per month ridiculous ,,2026-03-30T14:50:50,"[""billing"", ""customer_service""]",negative,"Customer cancelled their direct debit after experiencing significant and unexplained bill increases, with poor communication from the company about the changes."
48bd729dfb5716343555314050bfea6d264bc83bd3dbc8dc85b56a083df301bc,PlayStore,Susan Ann Simpson,5,Brilliant customer service,8.35.1,2026-03-30T13:40:31,"[""customer_service""]",positive,User praises the quality of customer service provided by ScottishPower.
1372c648020c510534b52337578030ce66610a032fd344a03193e92024aa7409,PlayStore,Robert Anderson,3,Had a problem loading onto my new phone had to use tablet,8.35.1,2026-03-30T13:28:24,"[""app_crash""]",negative,User experienced technical difficulties installing the app on their new phone and had to resort to using a tablet instead.
a93a34db5d5d8511adbd8e7e5c9d98a4caa2fabc4974f817448a96af0d38aacf,Trustpilot,Stuart lillicrap,4,Prices I was expecting a little bit lower with a EV charger?,,2026-03-30T13:23:43,"[""billing""]",negative,Customer expected lower prices as an incentive for having an EV charger but found the rates disappointing.
6c5d5d6e5c4bf0e79a2ee968dd168ba863524942788c003d32f86dbff0714db8,Trustpilot,Alex,1,"Just been informed by this terribly expensive company that my prices will go up from 1st April.

Instead of explaining how much I should expect to pay, they have provided a number of links for you to do your own research. Talk about making it complicated and making me feel that I could be charged whatever they want because it's not clearly explained.

I definitely do not recommend Scottish power and I just wish I had done more research before signing up with them. 
Just to add, I'm a business user on a fixed tariff
",,2026-03-30T13:08:25,"[""billing"", ""customer_service""]",negative,Customer is frustrated by lack of clear price increase communication and feels misled about charges despite being on a fixed business tariff.
b18de3c3948d357eed2511859078440ad13e82d5f05d9b6de8135a683a4fac51,Trustpilot,Mia Upton,1,"Don’t go with Scottish power! 
I changed my suplier over! What a joke that was! I think I was with them for about 2 weeks. Now they keep sending me a bill. I told them I’m
Not paying it. As I went back to my old supplier! I didn’t even top up with them! 😡🤷‍♀️ I was in my cooling off period. I changed back to my old supplier! Someone just said to me. I’ll get back to me! Then they hung up on me. 😡😡 
Don’t go with them! 
",,2026-03-30T12:54:08,"[""billing"", ""customer_service"", ""account""]",negative,Customer switched suppliers during cooling-off period but continues receiving bills and experienced poor customer service with unresolved issues.
3776ba735cafc2b4a19ad99d3f3e5782faa7c6d5d608a6729551ff32274a4281,Trustpilot,Angela Darling,1,I asked for a refund but it seems an impossible task. That's three phone calls and nearly an hour on your chat line. It would be another story if I owed for my electricity. Disgusted,,2026-03-30T12:43:28,"[""billing"", ""customer_service""]",negative,Customer is frustrated with an extremely lengthy and difficult refund process despite being owed money rather than owing it.
9388533f6f95366a7f6a16fd58e91f180b856122e5d27a4f7b6a9ddeefb71966,PlayStore,Jason Attfield,1,"Unable to use, need to top up. Customer service just cuts you of while waiting to talk to someone.",8.21.1,2026-03-30T12:37:59,"[""billing"", ""customer_service""]",negative,Customer unable to top up their account and frustrated by poor customer service experience with disconnected calls.
b73d599d4df5c4f3e69e930b9a9d3bae44f148910c9bee1a1d0337e947110aa8,PlayStore,Jamie Lievesley,1,"As with many others, I'm also not able to login, just get a login loop and error. I ""upgraded"" to a smart meter recently and now I can't top up at all! Terrible experience. I'm going to run out of power. The online support is useless, stuck behind a bot that can't answer basic questions, finally get it to connect me to a real human and turns out they're all busy",8.35.1,2026-03-30T12:24:54,"[""login"", ""smart_meter"", ""billing"", ""customer_service""]",negative,"Customer unable to login or top up their prepaid account following a smart meter upgrade, with ineffective support options leaving them at risk of losing power."
623355f7640c74ab2b3c92dbb8c6a4be365e97ae8aeac4402ca22aa93b7b9075,Trustpilot,Micheal Smyth,4,"The lady was very professional and handled my questions
",,2026-03-30T12:17:45,"[""customer_service""]",positive,User praised the professionalism and helpfulness of a customer service representative.
1f8effa6a2010ef7bca79b11582edb451989546b3727d398083ce5cc86ed1447,Trustpilot,Hafeez Rehman,1,"Switched my Dual account to Scottish power after asking the support team if my vehicle is eligible for anytime charge, which I was confirmed. Then checked on Scottish power Eligiblity checker multiple times and answer was eligible. So went ahead and switched accounts one by one, switching electric was another storey as was told, they already have an active Scottish power Electric account on my address, strange enough as I have been with Octopus since last 6 years. After about 5 calls that was sorted.

Now I have been told Scottish can't help me as they are unable to connect my vehicle on anytime change rate and been advised to take 12-5am saver Charging offer, in this process I have wasted a week and x 3 money to Scottish on charging in comparison to what I was paying to Octopus. So feeling clearly been let down by dishonest people. 

Based on my experience I will advise, Please double check that you are getting what you have been promised if you are switching to Scottish Power.
Thanks 



",,2026-03-30T12:05:09,"[""account"", ""customer_service""]",negative,"Customer was promised EV charging eligibility but ScottishPower could not deliver on the service after switching, resulting in wasted time and higher costs compared to their previous provider."
98d28ea557680694b544c147b7faea753d1dc74bcbc37e80d1a9afd9a2c0d6b9,Trustpilot,Abysmal Abysmal ,1,Six months to replace or repair a smart meter display/communication unit is very poor.,,2026-03-30T12:01:10,"[""smart_meter"", ""customer_service""]",negative,Customer experienced unacceptably long six-month delay in getting a faulty smart meter display unit repaired or replaced.
dc39a426f2591d8715f2fece0a349eddf5f4632185ecb9e8c1d524040269e66e,Trustpilot,A M,1,"This app has caused a lot of trouble for our family. Using the same email address and the same home address, it created two separate accounts for me (it might have been due to something I did, but I’m not sure what went wrong).

Another issue is that my wife wanted to access our account on her phone, but she couldn’t. It seems she would need to log in using my email on her device, which is very inconvenient. We haven’t even tried further because the process is too complicated.

It has been almost a month since we opened the account, and my account is still not functioning properly.",,2026-03-30T12:00:12,"[""login"", ""account""]",negative,"Account creation and access issues have left the user unable to properly use the app after nearly a month, with duplicate accounts and inability for multiple users to access the same account."
cfb8eda2e1b7750054627b1d34682b9894e04bfcdaa15c37c18876e43cf97e02,Trustpilot,Hayley Spicer,4,"Always helpful, quick to respond and the app is very easy to use",,2026-03-30T11:27:23,"[""customer_service""]",positive,"User praises the app's ease of use and the utility's responsive, helpful customer service."
a04828d2ea5281e8006f0108a86db0466a6f0e45e1a17e8480aea872fae47c84,Trustpilot,sunnie Odwyer,1,"From the start of me switching over I've had nothing but issues. I paid my £124 each month, i had £298 in my balance account, so I asked for a refund if your not using my account and then just decided to take £250 i asked why have you taken this, because I haven't give a meter reading, so I gzve meter readings and got £60 back, I will never recommend Scottish power to anyone and they still haven't give me a good reason why I apparently used all this gas and electric ",,2026-03-30T11:26:48,"[""billing"", ""account"", ""customer_service""]",negative,Customer experienced unexplained charges and unauthorized account deductions without clear explanation from ScottishPower despite providing meter readings.
1e33c0d29337d8cc15530a88e9b7d1b44bbace4ae147e3d87ac83eeae28aec24,Trustpilot,Michael Gendon,1,"I would give zero if possible but it’s not.

I received an email from Scottish Power regarding smart meters.

They obviously have not heard of the lie of omission. They say about dispelling myths. What they do not say is that smart meters enables them to remotely cut you off without any justification.

How can I trust a company like that when they have increased my bill whilst they recognise that they owe me even more than last year and refuse to refund.

Do not trust them. The unusually high amount of five stars reviews indicate so called AI bots paid for by Scottish Power.

Added as a reply to Scottish Power. The problem is your reply is an actual lie. I have to go through hoops and argue to get any refunds and that’s after waiting 30 minutes to an hour for an answer of a phone call. And then wait a month for a repayment.

As for cutting people off no one believes that you have not cut anyone off who has switched to electronic meter readers. As there has been a high level of complaints regarding your company and cutting people off.",,2026-03-30T11:23:01,"[""smart_meter"", ""billing"", ""customer_service""]",negative,"Customer distrusts ScottishPower due to concerns about remote disconnection capabilities via smart meters, unresolved billing disputes, and poor refund processes requiring excessive contact efforts."
4341e3ea4a51baf17bc7affb9b7a73463cdaa973be2865f5d5d795b0cce84992,Trustpilot,Mr Nigel Dixon,4,"The advisor I eventually got to talk to was very helpful and professional. I wanted to find out my rates and thought it would be on my account, NO!
I then went for frustrating chat with a bot###
I asked to be out through to a human, all agents are busy! Very frustrating to round in circles. Eventually I phoned and got holed of the agent and blood pressure went down. ",,2026-03-30T10:30:27,"[""customer_service"", ""account""]",negative,"User experienced frustrating delays with chatbot and long wait times for human agents, though eventual phone support resolved the issue satisfactorily."
ec51902016941b652298b04ea2f5b393b29afb873a80983cfef7899d75db8d8b,PlayStore,Tara C,1,"I've had so many issues lately with this app. I can't even log in now to manage my balance or top up, I get stuck in a log in loop and get a bland error message. As I'm disabled, I rely on this to be able to top up my pre pay meters, so my gas and electricity doesn't get shut off. I reached out to the support team and they just said they're aware of customers having issues.",8.35.1,2026-03-30T10:06:37,"[""login"", ""billing"", ""customer_service""]",negative,"User is unable to access the app due to a login loop issue, preventing essential top-ups for pre-pay meters, and support has provided no meaningful resolution."
e80516d6bdbe01330cd12ab16253f22c10bfa016fda58eb58c1b488375fb5711,PlayStore,stuart jenkins,1,can't log into the app. keep trying to reset password and the reset email says already used. can't top up my account this app is broken.,8.35.1,2026-03-30T09:51:10,"[""login"", ""account"", ""billing""]",negative,"User is unable to access their account due to a malfunctioning password reset mechanism, preventing them from topping up their energy account."
1bf442684943205bdffdcb86c80726a01e9ba1c5312eadda0e9b901d96496a1c,Trustpilot,Steven Varley,4,"Reasonable prices.
Power save credit",,2026-03-30T08:33:47,"[""billing"", ""other""]",positive,Customer appreciates competitive pricing and the Power Save Credit feature offered by the app.
4d8ac3da625129bb44f1952c82ceaabd57b2294cca2f76e52b329f2ca4d3d00a,PlayStore,Amber Dorn,1,"Terrible app. can never log in, system always seems to be down so switching",8.35.1,2026-03-30T08:25:35,"[""login"", ""app_crash""]",negative,"User is unable to access their account due to frequent login failures and system downtime, prompting them to switch providers."
2909db37c701ab0a5b60f4fe3b5854c462e8025bbc8a5c46a770416cb495240d,PlayStore,Francisco De Melo,5,Excellent service,8.35.1,2026-03-30T08:15:23,"[""customer_service""]",positive,User is satisfied with the overall service quality provided by ScottishPower.
31f25b0ceb8ba4a3aeb4cfd9a27129075935cd2ff982a57065d9844799c79edc,Trustpilot,Lisa Dudley,3,"I am currently a PAYG customer through choice as I wanted to see what I was spending, I have had a smart meter fitted after 2 failed appointments, I would like to find a better tariff but the App has no information or links and the automated chat is poor",,2026-03-30T08:08:09,"[""smart_meter"", ""customer_service"", ""app_crash"", ""billing""]",negative,"Customer frustrated by poor app functionality for tariff comparison and weak automated support, compounded by multiple failed smart meter installation appointments."
cfe04e7e737f01c5df75496ed5cabc4f3b9a61c4e832e55dd641380a8fbeed44,Trustpilot,Don't  Like reviews,3,Recently they increased their marketing campaign. Even called my daughter who lives temporarily with us. We also received a letter with someone’s name on it but with our address. ,,2026-03-30T06:24:03,"[""customer_service"", ""account"", ""other""]",negative,"Customer is frustrated by aggressive marketing tactics and data handling issues, including unsolicited calls to family members and mail sent to their address with incorrect names."
85111bba8a7e0a71b7a0a3335574de4c448afee3c9f0c1a9b34f7a6852df0931,PlayStore,Melisha Ryan,1,"Terrible functionality. The app shuts down periodically, logging me out multiple times with trouble logging back in even with biometrics. Tried to change the password but says link has already been used although it hadn't. It's really stressful sometimes trying to keep up with topping up the metre and monitoring credit, top up history ect... Seriously contemplating leaving Scottish Power due to these ongoing issues",8.35.1,2026-03-30T06:14:50,"[""app_crash"", ""login"", ""billing"", ""account""]",negative,Critical app stability and authentication issues are causing frustration with essential account management functions and driving customer churn consideration.
fa5156b8717b49886249129119ef7c84be3f185cac94fc76bb7b483f2925113c,PlayStore,Peter Oltersdorf (PeterO),1,Not been able to sign in for weeks now. Always get: something went wrong. It's infuriating.!!!,8.35.1,2026-03-30T04:24:50,"[""login""]",negative,User is unable to access their account due to a prolonged sign-in failure spanning several weeks.
2e968b4920468b75cc793b3d541431ca67013f1de6d504fb4966e48261e93469,AppStore,Unliterate internet user,1,"Why do you keep advising me to have a Smart Meter when the Engineer has been to assess the situation and advised me that it is not possible to fit one!! Second review of the day. Why are we getting all these stupid games and jigsaws. All I want to do is put my meter readings in. It was much easier to do on the old version. As an 80 year old women, I found the previous version easy. This updated version is overly complicated. I only want to put my metre readings in and can’t get to the correct page.

Meter Readings

The next meterreading is due and I haven’t changed my opinion. This new version is a complete mystery to me. How do you put your meter readings in? I’ve pressed every button but no good.
I’m afraid, I’m going to have to change suppliers. I can’t put up with this every three or four months. It was so easy before. Now it’s  just confusion. 
Geraldine Bruton Customer",8.28.0,2026-03-30T03:51:12,"[""smart_meter"", ""account"", ""other""]",negative,"Elderly customer finds the redesigned app overly complicated and cannot easily submit meter readings, threatening to switch suppliers."
78e607d5a9e3d25b379ad1af0381687286ae663ef730e65970fa41741a83fede,AppStore,Stpauls,5,"Great company to deal with, been with them for many years. I trust them, great communicators.",8.35.0,2026-03-30T03:26:19,"[""customer_service"", ""account""]",positive,"Long-standing customer praises ScottishPower for reliability, trustworthiness, and effective communication."
1f79a9010e919f93032ec1aa1a4355ce7174677babf5dde1528a35201ab286d8,PlayStore,Jeanette Beasley,1,ever since the last update I have not been able to login. I have even tried uninstalling and reinstalling it and still dont work,8.35.1,2026-03-30T03:02:47,"[""login"", ""app_crash""]",negative,"User is unable to log in after a recent app update despite attempting reinstallation, suggesting a critical authentication or compatibility issue."
