review_id,source,author,rating,body,app_version,date_posted,topics,sentiment,insight
fd399db1f2c38f8ef3b517ecc8343ef7d3832ee27c4c111386a35177950575c8,PlayStore,Reza Alizade,5,Scottish the best and most reasonable gas and electricity prices in the UK. thank you for your help. Al the very best.,8.32.1,2026-01-21T06:28:46,"[""billing"", ""customer_service""]",positive,Customer is highly satisfied with ScottishPower's competitive pricing and the support they received.
8193d06fcfe5f99dac36cba83e04476d20fdca066daad06bf2dfa3ad691fde04,PlayStore,Patty74,5,Never had any problems.,8.32.1,2026-01-21T03:19:31,"[""other""]",positive,User has had a consistently positive experience with the app and service.
414b35c939f9e65c3de708901233204cb136965928ec23fd5d006d61a15ca928,PlayStore,Sam Bowie,1,"absolutely dreadful app, never updates & never has contact with meter. Boxing day my electric went off. my app said I had £29 ,on yet meter said-90p (and also supposed to of been friendly hours!) Now gas is not updating. my usage is not making any sense either!!! gas used £3.76 day +charge does NOT equal = £25 which is what I've topped the meter up in just 1 day My gas app last night had over £15 on. yet on meter it had gone off. I'm disabled & unable yo reach my meter so it's ridiculous l",8.32.1,2026-01-20T23:14:06,"[""smart_meter"", ""billing"", ""outage""]",negative,"The app fails to sync accurately with the prepay meter, showing incorrect balances and usage calculations, leaving a disabled customer unable to monitor their energy supply."
89a11859a4458cf8bbbfa4ce7ed42474f826b7a255013059e96a387999d8645e,PlayStore,Anne Maitland,5,I Have Been With Scottish Power Since DAY 1...Why Change..,8.32.1,2026-01-20T19:12:28,"[""account""]",positive,"Long-term customer expresses strong loyalty and satisfaction with ScottishPower, indicating no motivation to switch providers."
5fc3c53d4b77266836ca3ac049e9c00c49987a367872531ff0a7b4aee26f3b04,Trustpilot,Elaine Bird,2,"Failed to send my new company all my meter details, so they have not been able to bill me , only got this sorted in 2026 ",,2026-01-20T19:02:50,"[""billing"", ""account"", ""customer_service""]",negative,"User experienced a significant billing failure due to meter details not being transmitted to their new energy supplier, with the issue taking an extended period to resolve."
b80fcf2235cb19f03c2f77fbf9cc0e1bb733be2f01a03a583f98eaf0aa6608cc,Trustpilot,Ann,2,Always helpful on the phone but requires several more phone calls to get anything done. Infuriating. A simple change over to a smart meter and a change of tariff took 2 months. Still not sure if it’s completed.,,2026-01-20T18:59:03,"[""smart_meter"", ""customer_service"", ""account""]",negative,"Despite helpful phone staff, the process requires excessive follow-up calls and takes an unreasonably long time to complete simple requests like meter upgrades and tariff changes."
0b7b2f5b55e555520c75c422580af53c6f91d114bea3daeb44700694deaf3e07,PlayStore,Alison Mike,5,"Mike, Moto g13 running android 14 (20/01/26) This app seems to work well. I am able to see my bills and change my direct debit when I need to and see usage. We haven't used many of the other features, don't need to. But, on our tablet the Powersaver link is there to see and it works, on our cellphone, it's nowhere to be seen.",8.32.1,2026-01-20T18:13:22,"[""billing"", ""account"", ""other""]",positive,"App functions well for core features like billing and direct debit management, but Powersaver link displays inconsistently across devices."
4e3b948d6c899f5bc7739f299d2c40c8c8431e97b3cc99b6cd7e8132d1759ac3,PlayStore,Dennis Snuggs,5,This app is so easy to use.,8.32.1,2026-01-20T15:06:04,"[""other""]",positive,User praises the app for its intuitive and user-friendly interface design.
03e8b398816cf89a9e51bbc85c6e5eb705695f90d65ab9076044428a012940fa,PlayStore,Tina Davies,5,Quick simple easy,8.32.1,2026-01-20T10:54:41,"[""other""]",positive,User appreciates the app's straightforward and user-friendly interface.
81fd7e75212094e4703d5ef67f414a4556dd576ff0a819dd7a0a1ecdc2d1de3c,PlayStore,Graham McConnell,5,best service around,8.32.1,2026-01-20T08:39:32,"[""customer_service""]",positive,Customer is highly satisfied with the overall service quality provided by ScottishPower.
8da67607ce3bd560935b04fa90f0ab408dbc2b6a4e426ba2ecde1f2a10598207,PlayStore,Margaret Higgs,5,I would want to know if my payments are covering my usage and if not I can amend my payments so as I don't get into any debt,8.32.1,2026-01-19T19:40:37,"[""billing"", ""account""]",positive,User appreciates the ability to monitor payment coverage against usage to avoid debt.
c55af2b14dccf4dcbb18705c37ecbcc8e6af69c8260cd9c5bd80bce0fa223ffa,PlayStore,Audrey Pointon,5,Easy to use,8.32.1,2026-01-19T18:06:29,"[""other""]",positive,User appreciates the intuitive and straightforward design of the app interface.
41b12d1be553d7a003fac2f50f760def7a8d17223b47f3cf2b11a597d31eff83,PlayStore,May Monaghan,5,it is good that you get bills on phone,8.32.1,2026-01-19T13:30:18,"[""billing""]",positive,User appreciates the convenience of receiving bills through the mobile app.
37d770ba8e1140b91206f8199e449d4e27545ff1d807cc9fd74b0cc6190d991b,AppStore,Ketoprom15,5,Good happy,8.32.0,2026-01-18T22:42:59,"[""other""]",positive,User expresses satisfaction with the app or service but provides minimal detail about what specifically they appreciate.
b485297998a65ba3d5e617e60fef16a8de10fded9713669513514477ba2ea26d,PlayStore,JAMES HUGHES,3,tried several weeks contracted customer service no joy at all very disappointed no technical advice on what seams a simple problem,8.32.1,2026-01-18T19:48:20,"[""customer_service"", ""other""]",negative,Customer frustrated by lack of technical support and unresolved issue despite multiple weeks of contact attempts.
24c03926ac5e6d881c8d0136f81c6b26a1bb3022728addc89a3ec8a21dab8fa9,PlayStore,Keely Wilson,1,The app is inaccurate and inefficient. when calling customer services for assistance they do not leave the script when you try and explain that your app does not have the button they are trying to tell you is there! have ongoing issues with the balance remaining updates despite having excellent WiFi connection to both meters and the app. Have ongoing issues with the topping up of meters due to the app and an ongoing issue with the meter not accepting the topup since moving to prepayment from DD,8.15.2,2026-01-18T18:37:55,"[""smart_meter"", ""customer_service"", ""other""]",negative,"The app has multiple technical failures including inaccurate balance updates and payment processing issues, compounded by unhelpful customer service that doesn't acknowledge app limitations."
a9079d062fc1ddce98dd913833fab64feadf321e16063025acce9dc952db89db,AppStore,bok 1256,5,Always a good service although my smart meter in house monitor doesnt seem to be fully working i wish someone would come and fix it,8.32.0,2026-01-18T08:03:38,"[""smart_meter"", ""customer_service""]",positive,Customer is satisfied with overall service but requests technical support to fix a malfunctioning smart meter in-home display.
f499202503a14b8bf2488ee1a8b58c807f82c36c149e16934a54a0fdd907fcb2,AppStore,Mature generation,1,I’m extremely annoyed that I can no longer access the app because I have an older phone! So it would seem I’m forced to buy a newer phone just so I can access the app and get up to date information about my account and the same applies to get into the web site!! Not so inclusive.,8.28.0,2026-01-18T05:21:25,"[""account"", ""other""]",negative,"User is unable to access their account through the app and website due to device incompatibility, forcing them to purchase new hardware to manage their energy account."
3241d92f5b6ed874387d367cf651cf2ecc558a4f6ee6efb93ccc2db864be52de,PlayStore,Sharon Thorpe,1,Does not work,8.31.1,2026-01-18T02:16:38,"[""app_crash""]",negative,The app is non-functional and unusable for the customer.
8fa21e07f973c8434cee6f9f3d44dda430400d47ef983278314b55f4127889ba,PlayStore,Stuart Clarke,4,always room for improvement,8.32.1,2026-01-18T01:17:52,"[""other""]",positive,User is satisfied with the app overall but recognizes there are areas where ScottishPower could enhance their service further.
2f917f9e19caf7c5dcb73d0c9e6e1d85e43383fb6950c6e867baa2dca1d6b6ed,Trustpilot,rich woodings,2,"How many demanding letters do you have to send in a month? , terrible system you have , if it doesn’t improve I’m a switching ",,2026-01-17T20:14:30,"[""billing"", ""customer_service""]",negative,"Customer is frustrated by excessive billing letters and poor system processes, threatening to switch providers."
fec1997273b76cd49725fb9c385e245ed8e4c970953b08ace74e9501e1dbc1fe,PlayStore,Carol Edge,5,good app easy to use,8.32.1,2026-01-17T19:29:30,"[""other""]",positive,User appreciates the app's simplicity and intuitive design.
d8120e543b091f8d9ddb0b3330b48dbae41e9bc8e3e7eb92fd696b6875270e33,PlayStore,Ekene Jeremiah Ifebude,5,Scottish power gives you satisfaction and quick response when you get in touch with them via chat or call...Happy to be a customer with Scottish power.,8.32.1,2026-01-17T09:41:53,"[""customer_service""]",positive,Customer praises Scottish Power's responsive and satisfactory customer support via chat and phone channels.
89b33a66accfdd35c6e6d14b437d441a379d9ce861ecd43aeaf0df520ecbb0b7,PlayStore,David Owens,5,"Easy to use, plenty of information",,2026-01-17T08:35:15,"[""account"", ""other""]",positive,User appreciates the app's intuitive interface and comprehensive information presentation.
6041132631c865256d1b68ceb6e8194dc689fc9639811323b8dc961dd0ca8f43,Trustpilot,Ann Lowe,2,Not great to be honest they keep telling  me it my meter is not cumunicating with them so why not sort it won't  be with you much longer. ,,2026-01-16T23:32:29,"[""smart_meter"", ""customer_service""]",negative,Customer is frustrated that ScottishPower has not resolved a persistent smart meter communication issue despite repeated reports.
71fefefbaf4b21c9784342bb95531c808e45c1c6519f1119ab5e3d8394046727,PlayStore,James Hipgrave,1,totally confused can only think AI has been used to produce this. from James Hipgrave.,8.32.1,2026-01-16T21:46:35,"[""other""]",negative,User finds the app confusing and suspects poor design quality potentially caused by AI generation.
8f1c9de2fa195b78a6d4620480b063b42ae58c1cda7a5f494d4436468a3b21db,Trustpilot,Xo,2,They lure you in with nice friendly staff but then Rude staff end up ringing you especially if fall on hard times ,,2026-01-16T18:52:53,"[""customer_service""]",negative,"Customer experienced a stark contrast between initial friendly service and subsequent rude treatment, particularly when experiencing financial difficulties."
7cc1e50deda3c128a7f239c5da1d2d8d9c2dfb064def0dbb5423e286de400648,PlayStore,Irene Bryan,5,very easy to use and helps me keep on track on my spend.,8.32.1,2026-01-16T17:56:09,"[""account"", ""billing""]",positive,User appreciates the app's ease of use and ability to monitor energy expenditure effectively.
b9e9d9ab511d31cc38c12082d8813912f3e7aecbb6ed497bfa3e3a428bdb8dde,PlayStore,Leighton Barker,5,"Extremely pleased with the set up for helping and informing customers of electricity account etc for not getting in Debt and keeping on track with monthly direct debits, it's a very good way of helping customers in these tough times. well done Scottish Power! it's a very good system in place. Many thanks! from Mr Barker.",8.32.1,2026-01-16T17:28:36,"[""account"", ""billing""]",positive,Customer appreciates the app's features for tracking electricity usage and managing direct debit payments to avoid debt during financial hardship.
3e3b07116667422d7b130cc7bb0e1052093608612801490920c4106b91746715,PlayStore,Philip Elworthy,1,unable to log in,,2026-01-16T15:29:16,"[""login""]",negative,User is unable to access their account due to login functionality failure.
d5159e879d7348c0371e95cc4a4a43e98976977d4d192681336bcf46853eb342,Trustpilot,Asim Malik,2,"Painful
Moved in and decided to maintain gas with Scottish power. Spoke to teams in South africa. Hit and miss. Account information continually incorrect.

Could and should have been easier. ",,2026-01-16T15:24:52,"[""customer_service"", ""account""]",negative,Customer experienced poor onboarding with inconsistent account information and offshore support that failed to resolve issues efficiently.
c4ab88eadd3bd15d33da57ace50e82360296de1ea031ec75a8852497b1792183,Trustpilot,Mr Andrew Goodfellow,2,Trying to move home and switchover but this the company couldn't organise this with different departments saying different things leading to much confusion and ultimately leaving this supplier ,,2026-01-16T12:33:32,"[""customer_service"", ""account""]",negative,Poor coordination between departments during home move switchover process caused confusion and led to customer switching suppliers.
fd2dccf2166a0be89005336fa2fd7b9160e4ed4974fc3178665111a0b24dfa48,Trustpilot,customer,2,"Difficult to understand call handler.
I do not believe the call handler fully understood my frustrations.
I have had an ongoing problem with my Gas Meter and Readings for many years and it has never been resolved and I have been paying gas with estimated readings for at least 3 years.",,2026-01-16T10:33:47,"[""smart_meter"", ""billing"", ""customer_service""]",negative,"Customer has an unresolved gas meter issue spanning years with estimated billing, and feels their concerns were not properly understood by support staff."
6a044e9419f1844ae3ff568305899dfee3ffe7471fdb25a16c8a72011659948c,PlayStore,Gary Bayliss,5,"Great service from SP, on meter reading input, summary bill is shown immediately. Plus loyalty credits make SP very competitive.",8.32.1,2026-01-16T09:17:38,"[""billing"", ""customer_service"", ""account""]",positive,User appreciates the app's quick billing summary feature and competitive loyalty credits offered by ScottishPower.
63ba2dee95a899d53bbae9882a280b5578815aefdbd4995050c2b8af16333d5d,PlayStore,Sharon Jack,5,very happy with them so far,8.32.1,2026-01-16T09:17:17,"[""other""]",positive,Customer expresses general satisfaction with ScottishPower's service.
5db71f6dd695a0db640ec0ecf9517cbfa436783bb06c67865b0b8e688d9206aa,PlayStore,Trevor Slater-Kinghorn,5,Thank you for all your help and support in all my dealings with you,8.32.1,2026-01-16T08:48:55,"[""customer_service""]",positive,Customer expresses strong satisfaction with the quality and helpfulness of support received from ScottishPower.
5140dced2cfb792263d47d264b2fd2f6d1d7666d0e7518c72a77826380c34fd7,PlayStore,Gill Tatton,5,all good so far.,8.32.1,2026-01-16T08:16:56,"[""other""]",positive,User is satisfied with the app's performance so far.
b79be17b8916c804640db5e1b958ee67f2963f19a82994d7d3ba3cfa844158bd,PlayStore,Malcolm Woodfield,5,Great 👍,,2026-01-16T07:56:25,"[""other""]",positive,User is satisfied with the app or service overall.
a9de14f502e24215d652507d71feb2b6faee63d5faeecc3003cbaea6604a9a71,PlayStore,david lothian,3,expensive gas prices like all energy suppliers,8.32.1,2026-01-16T07:54:05,"[""billing""]",negative,Customer expresses dissatisfaction with ScottishPower's gas pricing compared to competitors.
5f887befd0fe873269cc1cbc95d47646177fb4192e071648c0c49fb9220241ca,PlayStore,Donna Sudworth,5,there to help,8.32.1,2026-01-15T22:40:39,"[""customer_service""]",positive,User praises ScottishPower's customer service team for their helpful and supportive approach.
fc29a2b4d685c76b700c500fb76df447e4a6b34beede2fd065b0be2fd02b1a02,Trustpilot,Mr Darren K Walker,2,Very poor service and assistance ,,2026-01-15T21:03:49,"[""customer_service""]",negative,User experienced inadequate customer service and support from ScottishPower.
ccdeb93ef98cc9ac56870092a00288161cb910099c5fa4074c4973dee2178734,PlayStore,Gillian Taylor,4,"Love this app, find it really easy to use.",8.32.1,2026-01-15T18:16:23,"[""other""]",positive,User expresses satisfaction with the app's usability and user interface design.
5692cb2afcfed82920bc1f8ffcc2c40ca4e9a50cb2fea44fa90273c6952ba7d0,Trustpilot,Nikki,2,"I have spoken to four agents and explained my circumstances none was listening to me and was very aggressive I found it hard to understand them due to there language Barrier not mine as I was very clear I told them I was struggling with my mental health and they continued to threaten me with bailiffs, ccjs I am back at work next week and will deal with paying money owed but not interested just wanted to threaten me disgusting behaviour finally got someone that understood on the 15/01/26",,2026-01-15T16:21:30,"[""customer_service"", ""billing"", ""account""]",negative,"Customer received poor treatment from multiple agents who were aggressive, difficult to understand, and ignored their mental health struggles and payment circumstances, only resolving the issue with one helpful representative."
831053f752cd65cd29760017a72a3ea29ce580a07bb2527d265e446838583ec4,Trustpilot,TERRANCE THOMAS,2,"you keep promising but no action, I had one meter installed but it would not connect, a second meter was installed and that one would not connect. an engineer came out, carried out an investigation and
told me that there was no fault my end but the problem was being caused by a previous failed attempt to connect which haqd to be removed before a new connection coud be made, this had to be done from your end.  Looks like you are not doing your bit.
",,2026-01-15T15:14:16,"[""smart_meter"", ""customer_service""]",negative,Customer experienced repeated smart meter installation failures due to ScottishPower's failure to resolve a previous connection issue on their end.
2caf9067c53006181ab89b41faa124d9eeefb9f97738f98b646d932038d5f4aa,Trustpilot,Mrs Janet Drakes,2,Outside meter isn’t working nor is the smart meter. Told I will have to wait months for an engineer to come out to fix it. Meanwhile I’m stuck with estimated bills.,,2026-01-15T14:58:07,"[""smart_meter"", ""billing"", ""customer_service""]",negative,"Customer is frustrated by non-functional meters and long wait times for engineer repairs, leaving them reliant on estimated billing."
d355a34aab012b1dc042b63dc971efb4ca55c82a29cd41dce4ee9ddbb87bbe44,Trustpilot,Stuart ,2,"Constantly sending letters telling me I need to top up my meter.Every time i check the meter it doesn’t show the money I have been putting in
Download the app to find my usage and found I had hundreds of pounds in credit on my gas account phoned customer service and really didn’t get anywhere 
This money would be better served in my account than Scottish Powers",,2026-01-15T12:02:48,"[""billing"", ""smart_meter"", ""customer_service"", ""account""]",negative,"Customer is frustrated with unclear meter top-up tracking, significant unresolved account credit, and ineffective customer service support."
58c1b00e582970d9cffa1dcb8ed16dba023dd6cab6771c0f14a8de97c929809f,Trustpilot,Lauren Rogers,2,Had a smart meter fitted to take advantage of the half price power offer on a weekend. The hub wasn't working so called after a few days to inform them of this. They said the meter was still sending readings and not to worry. Around 2 months later I received an email with an estimated bill. I replied asking why it has been estimated when I have a meter. No response. I called today and was informed the meter isn't working and they are unable to send anyone out to fix it for the foreseeable. I asked whether the half price discount would be backdated and they said no. Not good enough. ,,2026-01-15T11:35:38,"[""smart_meter"", ""billing"", ""customer_service""]",negative,"Customer's smart meter hub has been non-functional for two months, their bill was incorrectly estimated despite having a meter, and ScottishPower refused to backdate the promised half-price weekend discount or provide a repair timeline."
731b51ad218b56b2fb568066713120a3585c53e5cdb943a83a6a01ce5a16ecbd,PlayStore,T,5,so far so good I'm able to pay my bill how I want. I can amend my payment to keep myself from being in debt. l get recommended a tariff I can say no and pick another.,8.32.1,2026-01-15T08:00:49,"[""billing"", ""account""]",positive,"User appreciates the flexibility to manage payments, avoid debt, and choose their preferred tariff without being forced into recommendations."
57b27f86d7c8c73269dead5cce6a4190491f9f8c4772575f6750132929b11827,PlayStore,Daniel Rozario,5,Excellent service and provide good information to save money.,8.32.1,2026-01-14T23:42:11,"[""customer_service"", ""account""]",positive,Customer appreciates the quality of service and finds the app helpful for identifying cost-saving opportunities.
d96ac204858942882565a095be4ca09a957f8a81e0fb47c67219701bc329d10b,PlayStore,Denise Johnston,5,very helpful.,8.32.1,2026-01-14T22:00:10,"[""customer_service""]",positive,User had a positive experience with customer service support.
989df3c1a71d5ade9d45b78709c1679f93630453e54d69881c3f39de30bb394e,Trustpilot,Mr A Macaulay,2,"New Smart Meter installed. Doesn't work.
Meter readings asked to be submitted. New meters not registered so unable to submit meter readings.
Refund requested, but unable to obtain because meter readings were required.
Meter eventually registered and then have to wait 14 days for refund.
You're lucky, as you only got a two star rating because the advisor I spoke to was polite, courteous and professional, unlike your organisation.",,2026-01-14T21:54:11,"[""smart_meter"", ""billing"", ""customer_service""]",negative,"Smart meter installation and registration failures prevented meter reading submission and delayed refund processing, though customer service staff were professional."
94cdf6a3fbf63fbfb5faadc332db724dd92fed5eb52eccdd477f16bfa37cac6e,Trustpilot,Shelley Gamil,2,Scottish Power decided to give me a refund without asking me i only noticed when I went into my Scottish Power account. I rang SP as soon as I noticed asked them to cancel it. Next day got a knock at door the cheque got delivered to to a neighbour . Again phoned SP told them what happened they asked did I still want to cancel i said said NO its here now will put it in bank Monday. I rang SP today (wednesday) as the bank hadn't put the money in my account got told I have to go down the bank and they should be able to tell me why the money hasnt been put in. Had to get a taxi to town centre im not well myself got to bank and got told SP took the money back Tuesday. Phoned SP when I got out of bank and was told now ive got to wait for 10 to 14 days to get cheque back!!! It takes SP 1 minutes to take the money back but it takes 10 to 14 days for them to give you your cheque I cant understand  why !! There is NO communication properly ive had trouble with SP 2yr ago over £800 refund you was adamant I had the cheque told me 3 different story's how it had been cashed i was up n down the bank getting statements I ended up in hospital through all the stress you put me under basically accusing me of cashing the cheque and then it was FOUND in whatever office the cheques get done in !!. And now we're on different scenario with this latest cheque. I cant go direct debit as im always to much in credit . Please sort this out as ive had enough headaches now with your company,,2026-01-14T20:39:05,"[""billing"", ""customer_service"", ""account""]",negative,"Customer experienced significant frustration with poorly managed refund processing, inconsistent communication, and lack of accountability across multiple incidents over two years."
f9e3fd979dfd27a600bc4716fe9c281b49e64595d9c803e3fcd117048da2699a,Trustpilot,Mr D Walker,2,Changing tariffs was difficult as I was unable to see clearly how the tariffs would change. I was unable to see how the new tariffs compared directly to my old tariffs as I changed to the Solar PV tariff.   The ordinary tariff has inreased dramatically ,,2026-01-14T19:10:36,"[""billing"", ""account""]",negative,"User found the tariff comparison process unclear and lacks transparency when switching to Solar PV tariff, with concerns about dramatic price increases."
4610372ceba35da774db0ba39cfb56c6ea43ca2a6840b0c2c6f68eb971c71b30,Trustpilot,Jackie Hampson,2,"I have been waiting since Friday 8/1 for a phone call regarding my meters and smart meter to enable me take advantage of the half price weekend electricity.
Came away from octopus for their false promises hope it's not out of the frying pan into the fire.",,2026-01-14T14:37:54,"[""smart_meter"", ""customer_service""]",negative,Customer is frustrated by lack of promised callback regarding smart meter installation and skeptical after poor experience with previous provider.
11ab47b3c55561850e7d5e50563c3ac5ca25ce4e2c2712bd7f592a4db0446173,Trustpilot,Richard,2,The amount of my direct debit fluctuates wildly causing me to either be massively in credit or debit.,,2026-01-14T13:56:04,"[""billing"", ""account""]",negative,"Customer experiencing significant fluctuations in direct debit payments, resulting in problematic credit or debit balances."
50f2c183f9907cf0e5e07d6b92e21597b41f2ce7a78245336fb8081269ff41da,Trustpilot,THOMAS,2,"im fed up of giving my meter reading then a bill is generated,then i pay the same time,Then all i get is harassment urgent or action required!please pay,when i have paid like my last one you sent me an e mail at 01.00am thanking me for my payment of £140 which ment my bill was paid,then at 06.27am the same morning action required £331 bill needs paying ,just crossed wires all the time no wonder you get into such a mess with peoples bills",,2026-01-14T13:19:01,"[""billing"", ""customer_service""]",negative,Customer is frustrated by repeated billing errors and conflicting payment demands despite submitting readings and making payments promptly.
