review_id,source,author,rating,body,app_version,date_posted,topics,sentiment,insight
a80a83bdf4eb4b09e8c5631f76c292f5a5e99378a6339a27067193d53c07ce21,Trustpilot,Miss.Karen Calladine,3,"Telephoned my Solar readings in last week. 
Again I have not received paper invoice by post for 2 previous readings in 2025. 
Not happy with Scottish Power.
",,2026-03-19T19:17:31,"[""billing"", ""customer_service""]",negative,Customer is frustrated with not receiving paper invoices for multiple solar readings submitted to Scottish Power.
ad0fb7660e1781e50f2a0cd91d138a51353ee1351a77dfc0f7776b642ded0bf4,PlayStore,Uchendu Cynthia,5,It was nice and quick,8.34.0,2026-03-19T18:28:27,"[""other""]",positive,User appreciated the speed and efficiency of the app experience.
a0341ee7602ff49f6c6539d4677ec04cedd07e1bc2b38ef984a901ed762e0846,PlayStore,Adedoyin adesanmi,5,Nice app,8.34.0,2026-03-19T17:13:03,"[""other""]",positive,User expresses general satisfaction with the app's functionality and design.
cd766607f20a673424bc7e448f6ca5328258c043a628a4492312b8c9fd3b6327,AppStore,Karakalpak,1,App sends to web version which sends OTP to email but no option on the app to enter OTP,8.35.0,2026-03-19T15:59:10,"[""login""]",negative,"User cannot complete login due to missing OTP entry field in the app, forcing an incomplete authentication flow."
0fd24dd078ef4e68ef3c5aa778fbfe58732a00d169d2e2595a90e0323a9cbc0e,Trustpilot,Barbara Thompson,2,"More knowledgeable advisors and less of being put on hold. Also, a quieter background.",,2026-03-19T15:20:48,"[""customer_service""]",negative,"Customer is dissatisfied with the quality and availability of advisor support, citing long hold times and poor call environment conditions."
cf18c55a1990e517cf84b35c1444f041eb34a831ad54464cfb720e0381230c9e,Trustpilot,HappyCook,3,"I found from your website that you had no meter readings from me for the past two months, but you collect them automatically multiple times each day, so has something gone wrong? I got a key to a plant room containing meters for all the flats and read my meter. It was very easy to submit the reading on your website, but why did I need to do that?",,2026-03-19T14:36:09,"[""smart_meter"", ""billing""]",negative,"Automatic meter readings failed to be collected for two months, forcing the customer to manually submit a reading despite the system's supposed automatic collection capability."
d323ee7c8e4147d72b022aca89b882121248ebc2d21cbd2bbfc05245f9ab50c8,Trustpilot,Mr Greene,3,Customer service is a bit haphazard. Pricing should be on average cost per KW not marginal cost of gas powered electricity generation since Scottish Power does not have any. ,,2026-03-19T14:04:25,"[""customer_service"", ""billing""]",negative,"Customer criticizes inconsistent service quality and argues that pricing should reflect average costs rather than gas generation marginal costs, which are irrelevant to ScottishPower's renewable energy portfolio."
421e5b091175c64a802219e5996567d15e1cf83b7ef0dd09b934728a2a36178a,Trustpilot,PK,3,Difficult finding anumber where I could speak to a real person,,2026-03-19T13:26:52,"[""customer_service""]",negative,User struggled to find contact options within the app to reach human customer support.
c3cc4ecff0d74dbc1f92c34a9b6b228c226bf627633d5e99e6a9be9b1908c4fb,Trustpilot,Gedi,3,On fixed tarrif but they change dd whenever they feel like without telling. Also we have smart metter this company cannot sort us with smart device. Previous owners took it with them.  So really nothing good to tell about this company. ,,2026-03-19T13:24:30,"[""billing"", ""smart_meter"", ""customer_service""]",negative,Customer frustrated with unexpected direct debit changes and inability to get smart meter device replacement after previous owner removed it.
35d392f830f924c9bac31fd5386931ae90030316affabe24258ef1d9ae0cda02,Trustpilot,Derek  Butler,3,"AS ever I was confused, frustrated an very annoyed  by your online instructions, especially about the security code  which kept changing every time i tried gto tosubmit it, but once I was  able to actually speak to an advisor shr was most patient and helpful and guided me throught, evegn though h er indian  accent was a little unclear at times.",,2026-03-19T12:25:32,"[""login"", ""customer_service""]",neutral,User experienced frustration with confusing online security code processes but praised the patience and helpfulness of phone support despite minor communication difficulties.
87567e5cdf0252f027fe23c421c03d7f33f8f03d3cca0082eac2f530db9be8d7,PlayStore,Mustafa Omar,5,Wonderful,8.34.0,2026-03-19T11:26:30,"[""other""]",positive,User expresses strong satisfaction with the app or service but provides no specific details about what they appreciated.
3eadfa42db7268ff434e188f8be6fcf04f98b9ee61649498a47edf496ce47cfb,Trustpilot,Ian Bagshaw,3,"The company is not proactive and relies on the customer to instigate solutions to problems that should be noticed far more quickly by SP than the customer is able.
I refer to the reduction of a large credit balance by greatly reducing my Direct Debit until the credit balance is virtually gone.  It can be updated by you at any time that you like but it stays unaltered for weeks on end and is hence wrong for much of the time.  This has now been achieved but I had to do all the running.",,2026-03-19T10:42:31,"[""billing"", ""customer_service""]",negative,"ScottishPower fails to proactively manage credit balances and account adjustments, requiring customers to initiate corrections themselves."
6892f7947149307c8a89b702383421f3d533e7f4340a1fd04b5d3cb3e2e67d6b,PlayStore,Pat Hustings,5,easy to use,8.34.0,2026-03-19T10:33:48,"[""other""]",positive,User appreciates the simplicity and ease of navigation of the ScottishPower app interface.
2297414737713d6fe2810fe2049d2197a57a17be010369de04584b692351aefe,AppStore,ErUpNorth,1,"Unable to sign in, just keeps going back to log in screen after entering password 😢",8.35.0,2026-03-19T10:15:36,"[""login""]",negative,User is unable to access their account due to a login loop issue where the app repeatedly returns to the login screen after password entry.
d3aec1b1eee5ec2c058dcaee9f90005ce58dfac8d08c2529c6b6eab6519d60b0,PlayStore,David Savage,1,"continuously tries to update staffing there is a new version available, doesn't let you open the power saver app.",8.34.0,2026-03-19T09:25:46,"[""app_crash"", ""other""]",negative,The app's frequent update prompts are preventing users from accessing the power saver feature.
c0b9eca617e18c5ab1b44dbaacafe57e55b652363a959be4aad9601c836cb7c5,PlayStore,Zabih Rahmani,5,تشکر عالیست,,2026-03-19T09:11:11,"[""other""]",positive,User expresses gratitude and satisfaction with the app or service in Persian.
da566e6addee07d3e0cf25c7aa70a17f53e12e0ab642f2f9c9ab87d34d82966e,AppStore,Halowa,1,"This app used to be great.  Not it’s rubbish. It would tell you the energy use every day, as soon as you entered meter readings your balance updated - it just worked really well (all features). But in the last 12 months or so it has gone downhill, as if it’s being developed by primary school children and now it’s useless. Full of bugs that are never fixed, basically the opposite of what it was a few years ago.",8.35.0,2026-03-19T08:46:32,"[""billing"", ""app_crash"", ""other""]",negative,App quality has significantly deteriorated over the past year with persistent bugs and loss of previously reliable features like daily energy tracking and real-time balance updates.
953bfe9dcd89639fd72a0c753aa6b0a8e544b28afac2c15b1f298bbdc8fbcc9b,PlayStore,Bernadette Neil,5,app so easy to use effective service,8.34.0,2026-03-19T01:20:23,"[""app_crash""]",positive,User praises the app for its intuitive interface and reliable performance.
0712fa8b054f2243f93dfc98f889bf69a5de250ae5b15b5228fe6f7c857547ad,PlayStore,Kevin Rankin,5,Good app and easy to use.,8.34.0,2026-03-18T22:24:27,"[""other""]",positive,User appreciates the app's ease of use and overall functionality.
c8dc33cf37f6e0e6ac2fc93338d07c8bc968a50d87c571517afab3abb82b763a,Trustpilot,Neil bennett,3,"Could be easier to navigate.
Still not compatible with others ",,2026-03-18T19:56:37,"[""account"", ""other""]",negative,User finds the app difficult to navigate and reports compatibility issues with other systems or devices.
18fd27ee80daf6a8c0dcf2545d0c25bf186cdacafd3259d0f01798c46f7ab281,PlayStore,Marie Surtees,5,been an excellent energy provider,8.34.0,2026-03-18T18:32:40,"[""other""]",positive,User is satisfied with ScottishPower's overall service quality as an energy provider.
749453be8c8bdb2287b564cb201e08ae6fac89cb078a17f9061e02918cbbc033,Trustpilot,Neil Morton,2,3 times I’ve had engineers out to change meter at their request and 3 times they said they couldn’t change it. But still getting phone calls and emails saying I need it done. I phone them and they just don’t listen. I want the meters changed but I keep being told by the engineers they can’t do it.  The following week more emails and phone call saying I need to change my meters. 🤬🤬,,2026-03-18T18:13:28,"[""smart_meter"", ""customer_service""]",negative,Customer is frustrated by repeated failed meter change attempts and poor communication from both engineers and support staff who continue requesting the same action.
1c2c05d79f2c1bcc7a2d10fcb87a5be798359994578fbc58c9a2bff7223008df,PlayStore,NORMAN RIDLEY,1,"says I needed to update, so i did. CLosed and reopened - but it still wants me to update to do the power saver. Annoying/",,2026-03-18T17:52:14,"[""other""]",negative,User is frustrated by a persistent app update bug that prevents access to the power saver feature even after updating and reopening the app.
14e96f9563bc3fd194cc0b0d8d1a64309408d0ce77d6da547413ce5e4860f1dd,PlayStore,laura macfarlane,2,can't find the slots fir half price electricity,8.35.0,2026-03-18T17:28:19,"[""billing"", ""other""]",negative,User is unable to locate information about half-price electricity time slots within the app.
c10c776e4b427b0841c36c473be4698430c2950484b163d3030c9f74a4d3018d,Trustpilot,James Clack,3,"The  advisor washelpful,but  Id to  call  back bescause my supply wasnot restored it got to the stage where I was going to call the  Ambulance as my mediical equipment runs on electric. ",,2026-03-18T12:22:09,"[""outage"", ""customer_service""]",negative,"Customer's power supply was not restored promptly despite contacting an advisor, creating a dangerous situation for someone dependent on electrically-powered medical equipment."
2154043612918ce0156141ac4f2ae79d2c9e9de6a9291773df858865b004314c,PlayStore,Corinne Bell,5,no problems,8.34.0,2026-03-18T11:51:31,"[""other""]",positive,User reports no problems with the app and is satisfied with their experience.
724ba67ab232451546ce73a80ff516ad4aad42955203f1e47ade4ada14e6c5a1,Trustpilot,LizM,2,I wanted to renew my contract on 10/02/26 but at a reduced cost . 10 phone calls and emails later finally got an advisor willing to help and actually helping ! Most advisors I couldn’t understand due to accent or poor use of English language and most didn’t know how to help - referring me to online form which was not showing my new terms and so couldn’t be used in this instance . The final advisor checked the history new terms of contact and set it up for me - result! Maybe review your recruitment and make sure the online forms are accurate ,,2026-03-18T11:34:14,"[""customer_service"", ""account""]",negative,"Customer experienced significant difficulty renewing their contract due to poor customer service quality, language barriers, and inaccurate online tools, though one advisor eventually resolved the issue."
fcd99a276852d9f3465dcfa24b7138fbe2e33b7f4a744f21358737426bfe97ed,PlayStore,George Beazley,4,it is ok.,8.34.0,2026-03-18T09:16:31,"[""other""]",neutral,User finds the app acceptable but expresses no strong opinion or specific feedback about its features or performance.
aa393b2465945852fd7a1efb260953af0220fb063c45b9b1cc6b729eda30ded2,AppStore,Ziggybest,3,Yearly usage comparison disappeared. I found being able to show graph of two and three years comparison very helpful. That seems to have disappeared.,8.35.0,2026-03-18T08:58:09,"[""account""]",negative,User is frustrated that the yearly usage comparison and multi-year graph feature has been removed from the app.
9ca356c93b59ad58ddbdefda7a2c3ee7359d3840cedafb2009bdd719784926d0,PlayStore,A J K,1,updated losted password and it keeps telling me to upgrade even though done it .lets me get into old app but cant alter power savers,8.34.0,2026-03-18T08:31:15,"[""login"", ""account""]",negative,"User unable to update power saver settings after password reset despite app upgrade, with forced upgrade prompts preventing access to new app features."
2f7da290e96576dc1a648a4266ee9d50e816e5dd9069744cefbd32b25881d4cc,Trustpilot,Moyra Clark,3,Still waiting to have my smart meter fixed since it was fitted in December ,,2026-03-17T22:41:17,"[""smart_meter"", ""customer_service""]",negative,"Customer's smart meter has remained non-functional for several months since installation, indicating poor after-sales support and maintenance."
7ab6df7aa97f5157ea71002189bfef32e694a1d56407ad819bb4500faed049e9,Trustpilot,Not  Available,2, Customer for 4yrs with Scottish Power.  Have had periodic incorrect billing often having to work out correct billing for them followed by apologies and goodwill payment which never covered the time taken.   Have now changed to a different supplier and so far excellent. ,,2026-03-17T21:22:41,"[""billing"", ""customer_service""]",negative,Chronic billing errors and inadequate customer service resolution over 4 years prompted the customer to switch suppliers.
d354a1d20014df9f0afe5e5a0e96e1281ece8b4b9b0b25a3a1b5f9ca83691af0,PlayStore,alan livingston,3,not as easy as it should be.,8.34.0,2026-03-17T20:50:18,"[""other""]",negative,User finds the app interface or navigation unnecessarily complicated or unintuitive.
135d3f60cc6459147b4fc6baf4b8b9ad19b1ef3d9ca8465dbe4169f66ceb8f70,Trustpilot,Mrs Davidson,2,"Tha engineer that attended the house was very knowledgeable but could only do half the job so it was a waste of time 
So I’m still waiting on a new gas meter and no time for it to be fitted as yet",,2026-03-17T20:34:54,"[""smart_meter"", ""customer_service""]",negative,"Engineer visit was incomplete, leaving customer waiting for gas meter installation with no scheduled date."
286cd000deb6fcc1a6ffb8ac426aa11b810ff825a2ad9e5d70d1875a1276ec94,PlayStore,Pamela Gee,1,Useless,8.34.0,2026-03-17T20:03:52,"[""other""]",negative,User finds the app fundamentally unhelpful or non-functional but provides no specific details about the underlying problem.
9da27f4f05c26f1ebdc7d9c14b6d9e0dfc0749539cccc9a78ee30b2f9f0e6e28,PlayStore,Tracey Bolton,5,Good service,8.34.0,2026-03-17T19:41:22,"[""customer_service""]",positive,User is satisfied with the overall service quality provided by ScottishPower.
02d17515dddac68073461b8b8550324bb2eea14095ed18b7ab4e95b16474c98b,Trustpilot,Penny Anderson,2,"I have been a loyal customer with this company for decades but very disappointed in the level of support when I applied for £150 winter discount for this year which I haven't received,I'm dyslexic and have anxiety & psychosis alongside several other life long health problems, really thought they'd help me but instead I've been left feeling unsupported and more confused than ever,I'm not fit to work and doubt I'll be able to whatever years I've left,why isn't it how it used to be,ppl on sick were automatically awarded without the confusion of online stuff,which I have no one to help me apart from citizens rights which I cannot attend appointments because my anxietys flared up+left feeling depressed 😔",,2026-03-17T19:25:41,"[""customer_service"", ""account""]",negative,"Long-term customer with disabilities feels unsupported and confused by the online application process for the winter discount scheme, missing out on support they previously received automatically."
45d1b1542368f740c8d69ee39c80c0cf0163f897f5f88551305320b6ec7751eb,PlayStore,Dorothy Lloyd,1,its ridiculous it keeps saying same thing when I press super saver,8.34.0,2026-03-17T19:18:40,"[""account"", ""other""]",negative,"The app repeatedly displays the same message when the user attempts to access the Super Saver feature, preventing them from using this functionality."
27064bd3b8d9faa6e00d20e3784de6cb91c74a80ca14f8b5eaedc200757a19d2,PlayStore,eee eee,3,difficult,8.34.0,2026-03-17T17:42:36,"[""other""]",negative,User finds the app difficult to use but provides no specific details about which features or functions are problematic.
21bc1c89354d30d868f49a5395983412aea2d7cf91a261a63d56d63e456b0f9d,Trustpilot,Hilary Thompson,3,getting through to actually speak to a person is very long winded and sometimes difficult. I do not like talking to robots by pressing different buttons etc. when i eventually got through they were very helpful but is it worth all that just to speak to a human,,2026-03-17T17:04:39,"[""customer_service""]",negative,Customer finds the automated phone system frustrating and time-consuming despite eventual helpful support from a human agent.
d7ede3e0e46b503e585a6c842c9643969b41d7bf8017a25d2510235d32ff5d4b,PlayStore,K Solly,5,Always great service and always ready to help you with any problems,8.34.0,2026-03-17T16:56:15,"[""customer_service""]",positive,Customer praises the utility's responsive and helpful customer service team.
126cc29f363faf5d7a30668d5b388aef54969239edeb6bc5a313afe3ae4ffb6e,Trustpilot,Barrett,3,"The adviser was excellent , getting to an adviser was a nightmare",,2026-03-17T12:50:08,"[""customer_service""]",negative,"While the adviser's service was excellent, the difficulty in reaching an adviser represents a significant barrier to customer support."
3c11a737b27d968fb72ccd7be32bbaef879d2c4d71345a3ebbb92d5d8c4cc297,Trustpilot,Derek  Reilly,3,Tried to get answers via the app without success. Tried calling customer service my wait time was over an hour so hung up . Couldn't wait for a call back. ,,2026-03-17T12:29:58,"[""customer_service"", ""other""]",negative,Customer experienced poor service across multiple channels with unresponsive app support and excessive wait times for phone contact.
0a9b95bcf4be53a588e6544d6989d72e01f39cffe80aa95c6d7d39f16e7d3b87,Trustpilot,Knitting queen,2,Smart meter not sorted in 12 months monitor doesn’t work and nothing done!so dissatisfied ,,2026-03-17T10:43:07,"[""smart_meter"", ""customer_service""]",negative,Customer's smart meter installation has remained unresolved for 12 months with non-functional monitoring and lack of support action.
1b30271ca9010e16326c3e061995ee667ac84437aac8a4ad9f8556b31d6744ea,PlayStore,James Currie,5,so simple,8.34.0,2026-03-17T09:32:58,"[""other""]",positive,User appreciates the simplicity and ease of use of the ScottishPower app.
25d5ec8ab5933da8e2c3a000adf83525efad179972ef992da264f2e2f3145ccd,PlayStore,Michael Mcdiarmid,5,Great set up and easy to read app.,8.34.0,2026-03-17T07:58:32,"[""other""]",positive,User praises the app's intuitive design and clear layout.
34a5d1967fa6ce1366a469b334e70bb21723b82b0dfaaf70fecda9107ba6eb0d,PlayStore,Saiphin Prengaj,2,Good,,2026-03-17T06:13:33,"[""other""]",negative,"User's minimal positive comment contradicts their low 2-star rating, suggesting dissatisfaction despite brief approval."
b10236dad734ef479df7f83f354c642de11f36b348df941a1a8b3b7713cfb368,PlayStore,Welliewalker UK,1,just hoes round and round through update and start up.,8.34.0,2026-03-16T22:15:43,"[""app_crash""]",negative,"The app is stuck in a continuous loop during startup and updates, making it unusable."
fd20bc24086f874f120bfdbbb1cd78e80ade45928ca80b28bde0f98566fb497f,PlayStore,Elaine Palmer,5,Easy - informative-& useful,,2026-03-16T18:30:31,"[""billing"", ""account""]",positive,"User appreciates the app's straightforward design, informative content, and practical functionality."
000bd9f675db5931f5f611e2a5162a3ac2289f970e0e50521999ed53e84ed527,Trustpilot,John Hilton,3,"Using the Scottish power app to move to a new tariff was straightforward and easy to do. However, the cost of the standing charge on a totally green energy tariff, whilst I am surrounded by wind turbines, is absolutely ridiculous. It is one of the highest standing charges in the UK! How much do folk on a green energy tariff, living 100’s of miles from green energy production, pay for their standing charge?",,2026-03-16T15:38:25,"[""billing"", ""account""]",negative,User appreciates the app's ease of use but is frustrated by what they perceive as unfairly high standing charges on green energy tariffs.
04128fec8b566e81966f93d00ac287fab5d1723a66f06b2787edd8fff3388676,PlayStore,A Google user,1,half price weekends change ? less hours and whats this 20% junk ????,8.34.0,2026-03-16T14:28:28,"[""billing"", ""other""]",negative,"Customer is dissatisfied with changes to the half price weekends offer, specifically regarding reduced hours and a new 20% charge they find unjustifiable."
fa5b95aa06ed621e8655a76cc6024f080c734e8f0c7d515050787a96ef95397b,AppStore,george pillai,5,Very good company. Easy to handle with our bills. 🙏🙏🙏🙏,8.34.0,2026-03-16T13:01:33,"[""billing"", ""customer_service""]",positive,Customer appreciates the ease of managing bills and the company's overall service quality.
7d471f80b6c6215b2852dad57105262de6cba5bc4f32777d25ccab60c69babb9,Trustpilot,Kathleen Peter,3,Not helpful with help for people with attendance allowance.,,2026-03-16T12:13:48,"[""customer_service"", ""account""]",negative,Customer felt unsupported when seeking assistance with attendance allowance-related billing or account matters.
697085000a9b7687c5134b9e9cc63df171ed430526526b7de49ba17286e2a85c,PlayStore,Diablo Blast,4,"worked fine, but hasn't in past",8.34.0,2026-03-16T11:33:37,"[""app_crash""]",neutral,App is currently functional but has experienced reliability issues in the past.
40c85fec44ad3ee1f29bc68dd47a774fa9d7705ef87b6aca83e32cfeb506dc03,PlayStore,stephen chesters,5,"great easy to use ,and the ability to choose cheaper electricity at certain times",8.34.0,2026-03-16T11:32:46,"[""smart_meter"", ""billing""]",positive,User appreciates the app's ease of use and the ability to take advantage of time-of-use electricity pricing to reduce costs.
cd092f24161836c71a4712568384b972160b0c366aa6b5b4d2f22091534780ea,PlayStore,Pat Rose,4,always been suitable for us,8.34.0,2026-03-16T09:44:19,"[""account""]",positive,User expresses general satisfaction with the app's suitability for their needs over time.
e9cbb889fd6d4b2d7e9a3030d111c2b510fd55dcdb6a9111957d2ca076411ef5,PlayStore,James McClelland,1,"Just the past week I've contacted Scottish Power customer service because the app isn't working as it previously was. I'm not longer able to login using biometrics, I have to use my full login details, email/password, then wait for an access code. I've unistalled/reinstalled the app numerous times,re-registered each time,cleared cache daily and restarted my phone after every action, it's sorts the biometrics issue for a few logins then goes back to the original issue of having to login manually.",8.34.0,2026-03-16T08:41:16,"[""login"", ""customer_service""]",negative,User is unable to use biometric login functionality despite multiple troubleshooting attempts and repeated contact with customer service.
e4b5df2007c9e77c140a649b8ce81695b94d9f1e196532ac430148d4fbe4dbaf,PlayStore,Albert Imafiabor,5,very good 👍,8.34.0,2026-03-16T06:43:03,"[""other""]",positive,User expresses general satisfaction with the app or service.
e2777270a0e4e016e663a2e9f4716078c88dc616cde58a5d9ba1173734bea2fd,PlayStore,Dave Perkins,2,"I do not like talking to a machine. I find it difficult to use computer and phones, I would rather like to talk to a person. I am to old now for this modern world.",8.34.0,2026-03-16T04:32:05,"[""customer_service""]",negative,User prefers human interaction over automated systems and finds digital interfaces difficult to navigate.
833a44ed6223e0db9a1ae136bafd8f01f242ebf91327f182f91901f3617a4a3d,Trustpilot,Emma  Law,2,The new monthly payment this year has raised 1/3 without an explanation. ,,2026-03-16T01:32:40,"[""billing""]",negative,Customer's monthly payment increased by one-third without clear communication or explanation from the utility.
de7987da071e3950a97fd72147fb8364a865f392f3406942be82bbfcd38d194f,Trustpilot,Sue Wall,2,"I no longer have access to Settings on my SP app, it's just disappeared. I have therefore lost the ability to use fingerprint recognition, but can still log on with email address, password, and using the code sent to my email address. As far as I know, I've tried everything, reinstalling app etc. but no luck. The most frustrating thing is I can only occasionally speak to an agent, and the auto robot is absolutely useless.",,2026-03-15T19:45:04,"[""account"", ""customer_service"", ""other""]",negative,"User lost access to app Settings and biometric login due to a technical issue, compounded by difficulty reaching helpful customer support."
608231ac8f8885ff0146b5b6278a9732ac1fa4d6e3c0432db0a52f670e0e19c5,PlayStore,Valerie Wells,4,I am happy with existing plan. .sorry in Hosp at the moment.,8.33.0,2026-03-15T15:42:45,"[""account""]",positive,User is satisfied with their current energy plan despite being temporarily hospitalized.
6f73658c8c3c6d8aebbd76ed824170e4c3d320d2a3c20a9d25a037edbebdb020,PlayStore,Christopher Twilley,1,Absolute bollocks. Cannot open the account on the app.,8.34.0,2026-03-15T15:32:20,"[""login"", ""account""]",negative,"User is unable to open their account on the mobile app, preventing access to their account information."
3d7eb4d2d9a6b2fde67924fc25ca8e1c0f66e5a5f13f10a6b7de070e63e68e9d,Trustpilot,Mahrukh  Kamran,3,Some good some bad,,2026-03-15T15:14:33,"[""other""]",neutral,User has mixed experiences with the app but provides insufficient detail to identify specific issues or strengths.
